2021GB04-093,★★,テセウスの船,,,イベント,マジカルユニバース,テクノロジー,歴史,,,2,,,,,,使用タイミング：通常 ■デッキの上から４枚を見て、その中の２枚を任意の順でデッキの下に置く。残った２枚から１枚を、相手にランダムに選ばせる。相手は選んだカードをコストを支払わずプレイする。その後、君は選ばれなかったカードをコストを支払わずプレイする。,,「こんな事もあろうかと、後継機を作っていたんだ。」 完成間近の宇宙船に聖杯を組み込みながらエドは言った。 「この船の最初のミッションは決まってるよな。」 「ああ、我らが緑色の英雄を探しに行こう！」
2021GB04-094,★,ガラクシアス・テンペスター!!,,,イベント,マジカルユニバース,ヒーロー,魔法,,,1,,,,,,使用タイミング：セットして、君が敵ユニットを３体以上破壊しているターンのアタックフェイズ終了時、相手のライフが２以下で、君が【装着】しているなら使える。 ■相手に２ダメージを与える！,,アドリアーノ「ヴォルテッカー！…いや、ステラ……いや違うな。三段突き！でもない。槍の必殺技って難しいんだよ！」
2021GB04-095,★,宇宙快速艇 ヴェルエネア号,,,ユニット,マジカルユニバース,宇宙遺産,フューチャーメン,,,2,4,5,2,OD,,【OD】「旅の道連れ」 デッキの上から３枚を見る。その中のレベル０以下の〈ピポバース・フューチャーメン〉１体をドライブしてもよい。残りを任意の順でデッキの下に置く。,,全長120メートル。中央部の銀河聖杯をエネルギー源とし、エドの発明したグラヴィティ・スタビライザーにより驚異的な速度と機動力を誇る宇宙一の快速艇。それがヴェルエネア（第九の矢）号だ。
2021GB04-096,★,デンジャラス軍団 奇怪メカ マッシュルームバンブー,,,ユニット,マジカルユニバース,エブリデイクライム,大地,,,2,4,5,1,,,■「マッシュルームシールド」 即時：［DR３］味方の〈エヴリデイクライム〉はターン終了時まで、効果ダメージを受けない。 ■「バンブーヴィレッジ」 これが君のカードや能力のコストで場を離れた時、敵ユニット１体以上を選び、４ダメージを割り振る。,,♫ キノコの基地のその奥に　タケノコのミサイルサイロがあったとさ ♫　絵にも描けない飽和攻撃だとさ ♫
2021GB04-097,★,宇宙エルフ デップ,,,ユニット,マジカルユニバース,戦士,フューチャーメン,レギンレイヴ,,2,3,3,2,CNT,,■「お宝発見」 これが攻撃した時、君の墓地の〈戦技〉のイベント１枚を選び、そのレベル分［DR］する事で、プレイしてもよい。そうしたら、そのイベントを墓地に置く代わりにデッキの下に置く。,１枚引く。その後、手札を１枚捨てる。,『黄金剣』を探してるんだ。アンタ知らないかい？
2021GB04-098,★,デンジャラス軍団　バンミキサー,,,ユニット,マジカルユニバース,アクシデンツ,エブリデイクライム,,,1,3,2,2,,,■「まぜるな危険」 これが場から離れた時、敵ユニット１体を選び、２ダメージを与える。,,♫混ぜるな危険　デンジャラス 仏の顔“で”３度まで　叩いて殴ってぶちのめす 死なばもろともあの世行き　あの世であの娘と混ざりたい♪ デンジャラス軍団パーティソング「混ざるぜ現在進行形」
2021GB04-099,★,キモカワ軍団　カリカリちゃん,,,ユニット,マジカルユニバース,エブリデイクライム,死影,闇,,1,2,5,1,,,■これが墓地から場に出た時、君か相手のダメージゾーンのカード１枚を選び、所有者のデッキの下に置く。そうしたら、そのプレイヤーの墓地のカード１枚を、そのプレイヤーのダメージゾーンに置く。,,ホラー軍団、キモカワ軍団、バイオ軍団、デンジャラス軍団……その他４軍団を含め８つの軍団全てが揃った時……エブリデイクライムに何かが起こる！
2021GB04-100,★,サメマン,,,ユニット,マジカルユニバース,サメ,ヒーロー,フューチャーメン,レギンレイヴ,0,2,1,1,,,■「私を愛したサメマン」 このカードはデッキに８枚まで入れる事ができる。 ■サメマン・タコトパシー【ターン１】」 通常：［１エナジーを支払う］君のダメージゾーンのカード２枚を表向きにする。 ■「サメマンは２度死ぬ」 これが破壊された時、これを君のダメージゾーンに置いてもよい。そうしたら、君のダメージゾーンのカード１枚を墓地に置く。,,宇宙の海では、強く優しく、時に獰猛であれ。
2021GB04-101,★,デンジャラス軍団 サルドッグ傭兵部隊,,,ユニット,マジカルユニバース,エブリデイクライム,気合,ピポバース,レギンレイヴ,0,3,1,1,,,■このカードはデッキに８枚まで入れる事ができる。 ■通常：［DR３］墓地のこれを特殊召喚する。,,互いの惑星を滅ぼしてしまい、手を組むしか無かったがゆえに傭兵団が結成された。
2021GB04-102,★,銀河聖杯,,,イベント,マジカルユニバース,アクシデンツ,宇宙遺産,,,2,,,,,,使用タイミング：即時 ■君のライフを１回復する。,,何と狡猾な！こんなところに聖杯を隠し持っていたとは！
2021GB04-103,★,銀河ヒッチハイク,,,イベント,マジカルユニバース,テクノロジー,名所,,雷,1,,,,,,使用タイミング：即時 ■以下のどちらかを行う。 ◯デッキから【CNT】を持たずレジェンドではないレベル２以下のマジカルユニバースのユニット１体を、相手に見せてデッキの上に置く。 ◯レベル２以下の味方ユニット１体を選び、場の自分の空いているゾーンに移動させる。,,「ええ。あたしは勿論『ほとんど無害』よ。目的地？そうね。『宇宙の果てのレストラン』まで、と言えば解るかしら？」
2021GB04-104,★,スペース・お化け屋敷,,,イベント,マジカルユニバース,アクシデンツ,エブリデイクライム,まじない,名所,-4,,,,,,【オープンカード】 ■このターン、お互いに攻撃できない。 ■君がジャンケンジャンキーなら、ジャンケンで決着をつけてもよい。君が勝った場合、君はこのターン、１度だけ攻撃できる。,,やーい、俺んち、おっばけやーしきぃ！ （エブリデイクライム配給アニメーション映画「となりのダイアクトー」より）
2021GB04-105,★★★★,ツノアルドン,,,ユニット,侵略次元,怪獣,雷,大地,ビースト,2,5,5,2,,,■「怪獣が出た！」 相手がユニットを場に出した君のターン中、即時タイミングでこれを手札から特殊召喚できる。,,東妖軍兵士達は不謹慎にも高揚を抑えられなかった。だって怪獣退治なんだぜ？
2021GB04-106,★★★★,彼方より来たりて終わらせる者,かなた,,ユニット,侵略次元,死影,破滅の使者,闇,,1,7,7,1,,,【召喚条件】［君の墓地にある《悪夢の落し子》を３枚除外］する。そうしなければ、これを墓地に置く。 ■「ヴァニッシュ」 これが場に出た時、場の相手のカードを３枚まで選び、ゲームから除外する。その後、ターン終了時までこれのSTK＋３する。 【貫通】,,悪夢に名をつけてはならない。
2021GB04-107,★★★★,鏖殺の戦場,おうさつ,,イベント,侵略次元,名所,歴史,,,2,,,,CNT,,使用タイミング：即時 ■［味方ユニット１体を墓地に置く］か［DR３］レベル２以下の敵ユニット１体を選び、破壊する。,■守備ゾーンの敵ユニットか【警戒】を持つ敵ユニット１体を選び、破壊する。,火雷と荒御鋒の連携により、邪神ハスターはディスティニーソードへと押し込まれ、両断された。 今やディスティニーソードは恐怖の象徴ではなく、屈することのない人類の勇気の象徴となった。
2021GB04-108,★★★,アンバーデビル ハートレス,,,ユニット,侵略次元,DWM,,,,2,2,4,1,,,【２回攻撃】 ■「フラッシュリッパー」 これが攻撃した時、［DR２/侵略次元］してもよい。そうしたら、敵ユニット１体を選び、３ダメージを与える。,,「0qdfq@;q@>uitkg6ht@kbZwe.gt@r.>」
2021GB04-109,★★★,ザムザザザムザ,,,ユニット,侵略次元,死影,大地,トレイター,ビースト,1,4,4,1,,,■「待ち焦がれた死」 相手が君のターンにユニットを場に出した時、これを破壊してもよい。そうしたら、その相手が場に出したユニットを破壊する。,,奴は生まれた時から、共に死ぬ相手を探している。
2021GB04-110,★★,獅死舞,ししまい,,ユニット,侵略次元,怪異,死影,ゾンビ,破滅の使者,0,3,1,1,,,■「黄泉の舞【ターン１】」 通常：デッキの上から３枚を見る。その中のこのユニットと同じ属性を持つカード１枚を墓地に置く。残りを任意の順でデッキの下に置く。,,侵略次元は、情報生命体すら自在に書き換える。
2021GB04-111,★,悪夢の落し子,,,ユニット,侵略次元,死影,破滅の使者,闇,,2,5,4,2,CNT,,【コスト軽減】場に君の〈死影〉があれば、［DR２］する事で、０コストでプレイしてもよい。 ■「積み重ねられる狂気」 このユニットはデッキに12枚まで入れる事が出来る。,デッキの上から４枚を見て、その中の《悪夢の落し子》１枚を墓地に置いてもよい。置いた場合、残りを任意の順でデッキの上に戻す。置かなかった場合、残りを任意の順でデッキの下に置く。,悪夢を理解してはならない。
2021GB04-112,★,クゥカラ,,,ユニット,侵略次元,オブジェ,DWM,,,0,4,1,1,CNT OD,,【OD】「兵装乗っ取り」 レベル２以下の〈ミリタリー〉の敵ユニット１体を選び、コントロールを得る。,これの『兵装乗っ取り』を使う。,ロシアで確認され、クゥカラ（人形）と呼ばれるようになったこのDWMには、突出した戦闘力はない。 だが奴らには、地球製の武器全てを使いこなせるという、恐るべき特性がある。
2021GB04-S01,SEC,フルール・ル・フェ,,,ユニット,ウォルナー,怪異,魔術師,,,1,4,4,2,TD  OD,,【TD】【OD】属性を一つ宣言する。ターン終了時まで、宣言した属性の味方ユニットはATK＋２、HP＋２される。,,なし
2021GB04-S02,SEC,鏡の国のアリス,,,ユニット,ATLAS,アリス,A7,覚醒者,,1,2,2,2,,レジェンド,■「彼女は私の夢で、私は彼女の夢の一部。」 通常：［これを除外する］君の墓地の〈アリス〉１体を選び、特殊召喚する。,,夢の中では私は戦士で、全ての世界を消してしまおうとする悪い人たちと戦うの。