2021GB04-049,★,KAKA死,,,ユニット,ATLAS,死影,ゾンビ,,,0,1,2,1,,,■「死を賛美せよ」 即時：［DR１/死影・ゾンビ、これを手札から捨てる］君が次に受けるダメージを２軽減する。 ■「生命を嗤え」 通常：［DR２/死影・ゾンビ］墓地のこれを特殊召喚する。,,死んだ筈の者が嗤い、生きている筈のものが生きたまま朽ち果てる。 我らは死影。生と死の境界線を踏みしだく、我らが王のお出ましだ。
2021GB04-050,★,ゲートルーラー護衛部隊 “ウィガール”,,,ユニット,ATLAS,ヒーロー,ミリタリー,,,0,2,1,1,TD  OD,,【TD】【OD】君のダメージゾーンのカードを２枚まで選び、表向きにする。  ■「エナジーリバース【ターン１】」 通常：［DR２］エナジー１枚を選び、アクトする。,,数少ないゲートルーラー能力者を守る専用装備は、ATLAS軍の技術の粋を集めて開発された。
2021GB04-051,★,マヴェット・ゲルート,,,ユニット,ATLAS,OWL,死影,トレイター,,0,1,1,2,,,■「異界への漏出」 これが相手にダメージを与えた時、君のダメージゾーンのカードを２枚まで選び、表向きにする。,,あのお方がこの世界に視線を向けた。その時点で世界は終焉を迎えたのだ。我ら死徒は、あの御方の意向を最後の務めとするであろう。
2021GB04-052,★,我欲の盾,がよくのたて,,イベント,ATLAS,サイキック,,,,0,,,,CNT,,使用タイミング：セットして、君にダメージが与えられる時に使える。 ■君が次に受けるダメージを２軽減する。,これをセットする。,暗殺者を恐れるようでは、歴史を作る事はできんよ。
2021GB04-053,★★★★Ⓛ,カミヨガタリ,,,イベント,東妖軍,まじない,歴史,,,3,,,,CNT,レジェンド,使用タイミング：通常 ■以下のどちらかを行う。 ◯君の手札からカードを２枚までコストを支払わずプレイし、１枚引く。（召喚権は使う） ◯２ドライブする。,ライフを２回復し、これを除外する。,
2021GB04-054,★★★★,ガシャドクロ改 “地獄破り”,じごくやぶり,,ユニット,東妖軍,怪異,気合,ロボ,,4,7,3,2,TD OD,,【コスト軽減】［DR４］するか、［手札１枚をデッキの下に置く］事で、２コストでプレイしてもよい。 【TD】【OD】君のデッキの上から２枚をこれのソウルに入れる。 　【ソウルガード】 ■「大刀一閃」 これが中央ラインを攻撃した時、守備ゾーンのユニット１体を選んでもよい。そのユニットは能力を全て失い、破壊される。,,侵略者よ　花の盛りと　みゆるぞや　風だに吹かば　我ものにせん。
2021GB04-055,★★★★,鬼垣コウメイ,,,ユニット,東妖軍,鬼the島,キーマン,魔術師,,2,1,6,1,,,■「鬼神招来【ターン１】」 通常：君の墓地の〈まじない・魔法〉を任意の枚数除外し、デッキから除外したカードの数ー２以下のレベルを持つ〈神・魔王〉１体を特殊召喚する。 ■「呪い返し【ターン１】」 相手が【CNT】を使った時、［DR３］してもよい。そうしたら、その【CNT】は『君に１ダメージを与える。』になる。（【CNT】を使用したプレイヤーがダメージを受ける）,,鬼と縁を持つ鬼ノ宮家を、呪術的に守護してきたのが我が鬼垣。ま、幼馴染でもありますしコウガさん。貴方の背中は守りますよ。
2021GB04-056,★★★★,黒百合,くろゆり,,ユニット,東妖軍,戦士,フューチャーメン,レギンレイヴ,,3,5,6,2,,,■これが場に出た時、守備ゾーンの敵ユニット１体を選び、破壊する。 ■「シグルーン【ターン１】」 通常：［これをデッキの下に置く］デッキから合計レベルが２以下になるように〈レギンレイヴ〉を２体まで特殊召喚する。,,心せよ。いつか黒百合が咲き誇り、貴様らの悪行を裁くのだ。
2021GB04-057,★★★★,竜型決戦兵器 “若雷”,ワカイカズチ,,ユニット,東妖軍,ドラゴン,ミリタリー,ロボ,,2,4,4,1,,,【直衛召喚】（これは相手のターン中、即時タイミングで手札から召喚できる） ■「残影機動【ターン１】」 即時：レベル０以下の敵ユニット１体を選び、レストする。この能力は相手のターン中にのみ使用できる。 ■「灼熱手刀」 これが攻撃した時、レベル０以下の敵ユニット１体を選び、破壊する。,,体高２M半。唯一の超小型竜型決戦兵器にして、我ら歩兵の戦友。
2021GB04-058,★★★★,出火ノ阿国,いずかのおくに,,ユニット,東妖軍,怪異,まじない,魔術師,,2,1,6,1,TD OD,,【TD】【OD】 「祓い給え」 君の墓地・ダメージゾーンのカード１枚を選び、デッキの下に置く。そうしたら、デッキの上から１枚をダメージゾーンに置く。 【創生召喚】素材：これと〈怪異・魔術師〉１体以上 素材の合計レベルと同じレベルを持つ〈怪異・魔術師〉１体をデッキから特殊召喚してもよい。,,遠つ御祖の神、笑ほほえみ給え。
2021GB04-059,★★★,倶利伽羅龍王,くりからりゅうおう,,ユニット,東妖軍,神,ドラゴン,炎,,3,5,5,2,,,■「仏罰大魔炎」 これが攻撃した時、または攻撃された時、相手に１ダメージを与える。  ■「智恵の利剣」 通常：［DR３］ これはターン終了時まで【警戒】を得る。,,うぬらは天地の理に背くならば、仏罰自ずと重いと知れぃ！
2021GB04-060,★★★,転身鬼人 ヨウマオウ,,,ユニット,東妖軍,怪異,気合,ヒーロー,,2,4,4,3,,,【装着】「妖魔転身!!」 【装着条件】なし 【装着能力】「妖魔念力」 これが相手に与えたダメージでは、【CNT】は全て『これを墓地に置く。』になる。 ■これがドライブゾーンから【装着】された時、１ドライブしてもよい。,,魔の首魁、山ン本五郎左衛門の「度胸試し」に打ち勝ったゲートルーラーは、褒美として「妖魔転身玉」を受け取り、鬼人への転身術を得た。
2021GB04-061,★★★,蛸地蔵,たこじぞう,,ユニット,東妖軍,怪異,怪獣,たこ,ヒーロー,0,2,2,1,,,■「地蔵天力【ターン１】」 これが攻撃した時、［DR２］してもよい。そうしたら、このユニット以外のSTK２以下の味方の〈怪異・怪獣・ヒーロー〉１体をアクトする。,,わしを知らんて？ わしの名前でググるんやし。ウェルズも多分、わしの伝説を元ネタにしたんちゃうか？
2021GB04-062,★★★,封魔 反閇,ふうま へんばい,,イベント,東妖軍,まじない,,,,1,,,,CNT,,使用タイミング：通常 ■以下のどちらかを行う。 ◯君のダメージゾーンのカードを４枚まで選び、表向きにする。 ◯相手のダメージゾーンのカードを３枚まで選び、裏向きにする。,これをプレイする。,反閇。伝統的な歩法呪術。邪気を踏み祓う清めとなり、また、異界の門を開き人ならざる者を招く召喚術ともなる。
2021GB04-063,★★,芝桜,しばざくら,,ユニット,東妖軍,戦士,フューチャーメン,レギンレイヴ,,2,6,3,2,CNT,,■味方の〈レギンレイヴ〉は相手の効果ダメージを受けない。,君の墓地の【CNT】を持たない〈レギンレイヴ〉を２枚まで選び、デッキの下に置く。,お前の見えぬ処に、足元に、気付けば血の芝桜が広がるだろう。
2021GB04-064,★★,遊蝶花,ゆうちょうか,,ユニット,東妖軍,ニンジャ,フューチャーメン,レギンレイヴ,,0,5,1,1,TD OD,,【TD】【OD】これの『レギンレイヴの誓い』を使う。 ■「レギンレイヴの誓い」 これが『シグルーン』で場に出た時、君の墓地の【CNT】を持たないユニットカード１枚を選び、デッキの下に置いてもよい。,,レギンレイヴの試練を乗り越えた東妖軍の女性兵士達は、花の名を冠する美しき戦士となった。
2021GB04-065,★★,大いなる力を我に,,,イベント,東妖軍,タクティクス,テクノロジー,,,2,,,,,,使用タイミング：通常 ■以下のどちらかを行う。 ◯デッキの上から３枚を見る。その中の〈ロボ〉１枚を、味方の〈ロボ〉のユニットのソウルに入れてもよい。この効果でソウルを与えられたユニットは【ソウルガード】を得る。残りを任意の順でデッキの下に置く。 ◯デッキからレジェンドではないレベル２以下の〈ヒーロー〉１体を特殊召喚するか、【装着】できるユニットなら【装着】してもよい。,,是非も無し。山田は軍の規約を破り実験兵器を起動させた。
2021GB04-066,★★,竜神旋風,,,イベント,東妖軍,戦技,タクティクス,,,3,,,,CNT,,使用タイミング：通常 【コスト軽減】場に君の“竜型決戦兵器”があれば、２コストでプレイしてもよい。 ■敵ユニット１体以上を選び、君の攻撃ゾーンにある全てのユニットの合計ATKと等しいダメージを割り振る。,これをプレイする。,ジャキコン！ 若雷が両肘を垂直に曲げ、独特なファイティング・ポーズをとる。 次の瞬間、アスファルトの地面が砕け、突風が巻き起こったかと思うと、若雷の手刀は敵の胸部を粉砕していた。（迅雷調布防衛隊異聞より）
2021GB04-067,★★,護国の鉄神,,,フィールド,東妖軍,まじない,歴史,,,1,,,,CNT,,■［これを墓地に置く］以下のいずれかを行う。 ◯通常：君の墓地・ダメージゾーンの《神器合神 ダイジンキ》１枚以上を選び、デッキの下に置く。 ◯通常：［DR４］する事で、デッキからレベル２以下の”益荒男”１体か“神器”１体を特殊召喚する。この効果で特殊召喚したユニットの【OD】を使う。 ◯即時：ターン終了時まで、君の〈ロボ〉は効果ダメージを受けない。 ◯レベル２以上の味方の〈ロボ〉が場に出た時、［DR２］する事で、ライフを１回復する。,これをフィールドゾーンに置く。,なし
2021GB04-068,★,竜型決戦兵器 “裂雷” 空戦形態,サクイカズチ,,ユニット,東妖軍,ドラゴン,ミリタリー,,,2,3,2,2,,,■「威力偵察」 これが攻撃した時、相手のセットカード１枚を選び、破壊する。 ■「スタンダップモード」 これが攻撃された時、［DR１、これをデッキの下に置く］事で、デッキから《竜型決戦兵器 “裂雷” 陸戦形態》１体をこのユニットが置かれていたゾーンにレスト状態で特殊召喚してもよい。,,「変形機構の修復は、次回出撃時には間に合わせます。」-裂雷整備班-
2021GB04-069,★,陸戦拡張兵装 “降魔”,ごうま,,ユニット,東妖軍,ミリタリー,ロボ,,,1,4,4,1,,,■他の味方の〈ミリタリー・ロボ〉にダメージが与えられる時、その全てのダメージをこのユニットに移し替えてもよい。,,長引く戦いから、東妖軍ドクトリンは人的被害を最低限に抑える方向へ修正。“降魔”はその生存性の高さから正式採用された。
2021GB04-070,★,鎌鼬のジロー,,,ユニット,東妖軍,怪異,ビースト,,,1,2,5,1,,,【待機】（【待機】を持つユニットは、セットできる） ■これはセットゾーンから通常召喚できる。 ■「僕ってセンターが似合うよね。【ターン１】」 これが守備ゾーンに通常召喚された時、［DR３］してもよい。そうしたら、デッキから“鎌鼬のジョー”と“鎌鼬のサブロー”を１体ずつ特殊召喚する。,,「この街、好きだったんだけどな。」ジローは人間のように悲しげな表情を浮かべた。 「……で、どのぐらいで元に戻るの？２日ぐらい？」
2021GB04-071,★,緑菊,みどりぎく,,ユニット,東妖軍,戦士,フューチャーメン,レギンレイヴ,,0,2,1,2,TD OD,,【TD】【OD】これの『移ろふほどに』を使う。 ■「移ろふほどに」 これが『シグルーン』で場に出た時、相手の墓地のカード１枚を選び、除外する。,,菊の花は弔い花。だけど私は、ただ貴方を切り伏せる為だけに有る。
2021GB04-072,★,猫反木綿,ねこたんもめん,,ユニット,東妖軍,怪異,布,ビースト,,0,3,3,0,OD,,【OD】「もふもふ・ぐるぐる」 ：［これを墓地に置く］敵ユニット１体を選ぶ。それは全ての能力を次のターン開始時まで失う。,,布団にすると、天にも登る気持ちよさ。そのまま天国に連れて行かれる。
2021GB04-073,★,夜道怪,やどうかい,,ユニット,東妖軍,怪異,死影,戦士,闇,-1,5,2,2,,,【召喚条件】（これを場に出す際、この処理を実行しなければならない）［場の君の〈怪異・死影〉１枚を破壊する］か［DR２/怪異・死影］する。そうしなければ、これを墓地に置く。 ■「霊鳴撃」 これが敵ユニットを破壊した時、相手に１ダメージを与える。,,なし
2021GB04-074,★,隠れんぼ,,,イベント,東妖軍,パラノーマル,まじない,闇,,1,,,,,,使用タイミング：通常 ■以下のどちらかを行う。 ◯相手の墓地のカードを２枚まで選び、除外する。 ◯レベル１以下の敵ユニット１体を選び、場の味方ユニット１体のソウルに入れる。ターン終了時、この効果でソウルに入れたカードのコントロールを相手に戻す。 ■墓地のこのカードは、２枚として数えてもよい。,,怪異、妖怪は情報生命体。人の心と、その文化の有り様とともにある。かれらは鏡。我ら人間の側に、ずっと昔から共に居た。
2021GB04-075,★,斬り込み,,,イベント,東妖軍,気合,戦技,,,0,,,,,,使用タイミング：即時 ■味方ユニット１体を選び、ターン終了時までATK＋４する。,,チェストオオオオッ!!
2021GB04-076,★,ローラーダッシュ,,,イベント,東妖軍,戦技,タクティクス,,,0,,,,,,使用タイミング：通常 ■味方ユニット１体を選び、次の相手ターン終了時まで【警戒】と【反撃】を与える。,,体高６メートル未満が適切。都市インフラにおいて効率的に運用可能な「陸戦拡張兵装」は、“降魔”“熊羆”によって完成された。
2021GB04-077,★,猫まっしぐら,,,イベント,東妖軍,神,タクティクス,テクノロジー,ビジネス,0,,,,CNT,,使用タイミング：通常 ■君の墓地の“ケットシー”または【ファミリア】を持つユニット１体を選び、特殊召喚する。,これをプレイする。,その伝説の猫缶を食べてしまうと、「全てを知った猫」になってしまうのだ。ただの猫では居られなくなり、虚無へと堕ちゆく事にニャる……だからそれは、僕にくれニャさい。
2021GB04-078,★,山は青き 水は清き ふるさと,,,イベント,東妖軍,名所,歴史,,,1,,,,CNT,,使用タイミング：通常 ■君の墓地のカード名が異なる〈名所〉を任意の枚数除外し、除外した枚数分、カードを引く。,君のライフが２以下なら、２回復する。,誰かを傷つけることのない、守るための戦争。 憎しみ合ってきた民族も、心通わせることのなかった怪異達も、共に手を取り合って立ち上がる。 有史以来、最も過酷で、最も誇りに満ちた時代。
2021GB04-079,★★★★Ⓛ,宇宙王族アスライア,,,ユニット,マジカルユニバース,キーマン,レギンレイヴ,,,1,2,2,0,CNT,レジェンド,■これは特殊召喚できない。 ■「人竜変異」 通常：これを除外し、君のデッキからレベル２以下の〈ドラゴン〉１体を特殊召喚する。 ■「シグルーン【ターン１】」 通常：［これをゲームから除外する］君のデッキから合計レベルが３以下になるように〈レギンレイヴ〉を２体まで特殊召喚する。,デッキから《スペースドラゴン アスライア》１体を選び、特殊召喚する。,「親愛なる緑色君、ちょっとウォルナーまでお使いを頼みたいんだ。お礼に君の帰るべき場所へと導いてあげよう。」 
2021GB04-080,★★★★,高次夢幻世界のアリス,こうじむげんせかい,,ユニット,マジカルユニバース,アリス,神,,,3,6,6,2,,,■これは守備ゾーンに置けない。 ■「虚空の戦場」 君の墓地の〈A7〉が１種類以下ならば、これのSTKは３になり、【反撃】を得る。 ■「ワンダフル・ワールド」 君の墓地の〈A7〉が７種類以上ならば、これのSTKは5になる。 ■君の手札の〈A7〉は【直衛召喚】を持つ。,,それは未来の可能性。
2021GB04-081,★★★★,デンジャラス軍団団長 ミサイルブッダ,,,ユニット,マジカルユニバース,エブリデイクライム,,,,3,5,5,2,CNT TD,,【TD】君の墓地のレベル２以下の〈エブリデイクライム〉１枚を選び、手札に加える。 ■「即身成仏【ターン１】」 即時：［味方ユニット１体を墓地に置く］相手に１ダメージを与える。 ■「成仏拒否【ターン１】」 通常：［DR４/エブリデイクライム］墓地のこれを特殊召喚する。,「南無阿弥ボンバー」 相手の墓地のカード１枚を選び、相手のダメージゾーンに置く。,拙僧より献じよう。新曲『地獄のサタンもカネ死die!!』 Slay！レッツBACHIATARI!!
2021GB04-082,★★★★,スペースドラゴン アスライア,,,ユニット,マジカルユニバース,覚醒者,ドラゴン,レギンレイヴ,,2,5,4,2,,,■これが場に出た時、デッキの上から３枚を見る。その中の〈ドラゴン・レギンレイヴ〉１枚を、そのカードのレベル＋２の［DR］する事で、特殊召喚してもよい。残りを任意の順でデッキの下に置く。 ■即時：［手札１枚を捨てる］これはターン終了時まで、効果ダメージを受けない。,,可能性を奪う世界と無限の可能性を持つ世界……マジカルユニバースとはアンチ侵略次元なんだ。
2021GB04-083,★★★★,宇宙アーサー・アドリアーノ,,,ユニット,マジカルユニバース,ヒーロー,ロボ,,,3,6,6,3,CNT,,【装着】「コンセクレイション!宇宙アーサー!!」 【装着条件】君のライフが５以下 【装着能力】君は効果ダメージを受けない。【装着】した次のターンの終了時、これを墓地に置く。,以下のどちらかを行う。 ◯君のライフが５以下なら、これを【装着】する。 ◯ライフを１回復する。,聖杯に飛び込んだアドリアーノは、宇宙の意思、銀河聖杯に選ばれし聖騎士となった！
2021GB04-084,★★★★,スペースヒーロー・ サングリップ,,,ユニット,マジカルユニバース,気合,ヒーロー,フューチャーメン,レギンレイヴ,2,4,4,1,,,■「シグルーン【ターン１】」 通常：［これをデッキの下に置く］君のデッキから合計レベルが１以下になるように〈レギンレイヴ〉を２体まで特殊召喚する。 ■「エナジーリバース【ターン１】」 通常：［DR２］君のエナジー１枚を選び、アクトする。,,キャプテン・エドと並び英雄と称される彼女は、「左手に恒星を宿す」と言われている。
2021GB04-085,★★★,聖杯の女神ロボ,,,ユニット,マジカルユニバース,宇宙遺産,気合,ロボ,,3,8,8,4,,,【強制待機】  ■通常：［場の君のカード１枚を墓地に置く］これをセットゾーンから通常召喚する。  ■これがセットゾーンで破壊される際、これを特殊召喚する。,,聖杯の力とは、選ばれし勇者に宇宙最強の戦士、宇宙アーサーの力を与えることであった。だが聖杯そのものが変形した聖杯の女神ロボは、ステゴロで更に強かった！
2021GB04-086,★★★,デンジャラス軍団　サメナイフ,,,ユニット,マジカルユニバース,エブリデイクライム,サメ,レギンレイヴ,,1,5,1,1,,,【貫通】【反撃】,,♫ 天に向かってツバ吐くぜ「BACHIATARI!!」 ご飯も残すぜ「MOTTAINAI!!」 俺たちゃ悪い子ナイフのようさ　うかつにさわると怪我するぜ　優しくグリップしてくれよ ♫ デンジャラス軍団軍歌「BACHIATARIな俺達」作詞作曲 ミサイルBUDDA
2021GB04-087,★★★,宇宙エルフ ジェニファー,,,ユニット,マジカルユニバース,光,ヒーロー,フューチャーメン,レギンレイヴ,1,2,6,0,,,■「レギンレイヴ・ネットワーク」 味方の〈レギンレイヴ〉は相手の効果ダメージを受けない。,,侵略次元に対抗すべく、数多の世界を渡る巨大船“アーク”。その下層に封じられた神がいる。 その者が与える試練に挑み、無数の挑戦者がレギンレイヴの力を獲得した。
2021GB04-088,★★★,たこ美ちゃん,,,ユニット,マジカルユニバース,怪異,たこ,ピポバース,レギンレイヴ,0,3,2,1,,,■「むげんのパワー【ターン３】」 通常：［DR３］ターン終了時まで、これのATK＋１、HP＋１、STK＋１する。,,たこ美ちゃんは故郷の海を守るためにレギンレイヴになったんだよ！たこ美バスターは作った神様も「やりすぎた」って言ってたぐらい強いんだよ！
2021GB04-089,★★,アンダー・ジ・アビス,,,ユニット,マジカルユニバース,死影,ドラゴン,闇,,3,5,6,3,,,【アビスシンフォニア】条件：君の墓地のレベル０、１、２、３ の〈闇〉を１枚ずつ任意の順でデッキの下に置く。 ■これが特殊召喚された時、これはターン終了時まで『これが相手に与えたダメージでは【CNT】出来ない。』を得る。,,可能性に満ちたマジカルユニバースでも、死影の尖兵は癌細胞のように増殖を始めた。
2021GB04-090,★★,スペースシャーク!!,,,ユニット,マジカルユニバース,イレイザー,死影,サメ,たこ,3,6,6,3,TD OD,,【OD】「ゾンビシャーク」 君のダメージゾーンの《スペースシャーク!!》以外の〈サメ〉１体を選び、特殊召喚する。 【TD】「サメテンペスト」 君の墓地の《スペースシャーク!!》以外の〈サメ〉１枚を選び、手札に加える。 ■君の手札のレベル１の〈サメ〉は【直衛召喚】を持つ。 ■「サプライズシャーク」 即時：［DR5/サメ・たこ］ダメージゾーンのこれを特殊召喚する。,,出ると思ってた！知ってた！
2021GB04-091,★★,謎の人脈 クリステル,,,ユニット,マジカルユニバース,フューチャーメン,,,,2,2,2,1,CNT OD,,【OD】「彼女は何かを握っている」 デッキの上から３枚を見る。その中のレベル１以下の〈フューチャーメン〉１体をドライブしてもよい。残りを任意の順でデッキの下に置く。,これの『彼女は何かを握っている』を使用してもよい。,クリステル「あら、私が頼めば誰だって快く来てくれるのよ。例えスペース法王様でもね。」 アドリアーノ「どんな弱みを掴んでるんだ、君は……」
2021GB04-092,★★,何という偶然。,,,イベント,マジカルユニバース,アクシデンツ,歴史,,,0,,,,CNT,,使用タイミング：即時 ■デッキの上から４枚を見る。その中の【オープンカード】を持つカード１枚をドライブする。残りを任意の順でデッキの下に置く。,これをプレイする。,エックスカリバーを手土産に組織へ帰ろうとしたリクルーターは、はずみで敵のブラックホール発生装置に剣をジャストミートさせてしまい、暴走したブラックホールに吸い込まれる。 エド「ありがとう緑色君……君は真の英雄だ。」ポジム「全部偶然ナンジャナイすカ」
