2020GB01-059,★,デスパレート,,,イベント,アトラス,ミリタリー,,,,0,,,,,,使用タイミング：即時（セットして、いつでも使える。） ■味方ユニット１体を選び、ターン終了時までATK＋２ 、HP＋２する。,,"日本の次元断層による侵攻と違い、欧州における侵略次元の攻撃は、「置き換え」と言われる現象によって行われる。
ある日突然、街の一角から人々が消失し、置き換わるように侵略次元の部隊が現れるのだ。
消失した人々の行方は、杳として知れない。",4
2020GB01-060,★,そんなダメージは気のせいだ！,,,イベント,アトラス,ミリタリー,ワイルドフォース,,,0,,,,,,使用タイミング：セットして、味方ユニットがダメージを与えられた時に使える。 ■味方ユニット１体を選ぶ。そのユニットは与えられたダメージと同じ分回復する。（致死ダメージに達して破壊されていても、墓地に置かれる前に回復する。）,,"♪オー、ワイルドフォース、悪を砕く鋼の腕。
野生の力だガトリング、自然の掟だ気化爆弾。
知恵が１割力が５割。残った７割勇気と力。",4
2020GB01-061,★,サプレッション・ファイア,,,イベント,アトラス,火力,ミリタリー,,,0,,,,,,使用タイミング：即時（セットして、いつでも使える。） ■敵ユニット１体を選び、２ダメージを与える。,,アドバイス！ ATLAS軍カードの魅力は、なんと言っても効果ダメージによるユニット破壊だ。“Gu★s＆Gold兵器工廠”を４枚入れてマジカルユニバースの火力カードと組み合わせ、コントロールデッキを作ってみよう！,4
2020GB01-062,★★★★Ⓛ,キャプテン・オーマイガー,,,ユニット,東妖軍,覚醒者,戦士,ヒーロー,,3,5,5,3,CNT OD,LEGEND,【OD】「マッハ88万３千353以上アタック」 敵ユニット１体を選び、破壊する。,これの【OD】能力を使う。,漫画家、桜舞河大将は自らの描く漫画の主人公へと変身した。しかし常軌を逸した設定と、致命的なデザインセンスにより前途は多難で……（長谷川裕一作品「スタジオ秘密基地劇場」より,4
2020GB01-063,★★★★Ⓛ,鬼The島隊長 鬼ノ宮 鋼牙,,,ユニット,東妖軍,鬼The島,キーマン,戦士,,3,4,3,2,CNT OD TD,LEGEND,【OD】【TD】「宿命の赫きゲートルーラー」 君のデッキからカード１枚を選び、デッキをシャッフルして選んだカードを上に置く。,これの【OD】能力を使う。,東妖軍きってのゲートルーラーであり、古の約定により鬼たちを従える「裏京都・鬼ノ宮（きのみや。「おにのつかさ」とも読む）」の当主。快刀乱麻を断つがごとき正義の快男児。,4
2020GB01-064,★★★★,カミガカリ,,,ユニット,東妖軍,神,,,,2,5,2,2,OD,,【OD】場の君のカード１枚を選び、破壊してもよい。そうしたら場の相手のカード１枚を選び、破壊する。 ■「障り」 これに戦闘ダメージが与えられた時、敵ユニット１体を選び、同じダメージを与える。（効果ダメージならこの効果は発動しない。）,,神や妖怪が現れた時、日本人は驚くよりも、懐かしさを覚えた。,4
2020GB01-065,★★★★,巨骸装甲 ガシャドクロ,,,ユニット,東妖軍,怪異,ミリタリー,,,3,7,2,2,OD,,【OD】君のデッキの上から２枚をこれのソウルに入れる。 【ソウルガード】（【ソウルガード】を持つユニットが場から離れる時、ソウルを１枚墓地に置くことで、場に留まることが出来る。） 【貫通】,,侵略者を打ち砕く、巨大な躯が咆哮する。其は、英霊たちの化身なり！,4
2020GB01-066,★★★★,竜型決戦兵器 “荒御鋒”,,,ユニット,東妖軍,ドラゴン,ミリタリー,,,3,5,5,2,,,■君が受けるダメージは１になる。 ■「魔力炉心砲」 通常［君のイベントカードを１枚、場から墓地に置く］敵ユニット１体を選び、４ダメージを与える。,,全国民の祈りを受けて、起動せよ！マシンドラゴン・アラミサキ!!,4
2020GB01-067,★★★★,千年桜,,,イベント,東妖軍,歴史,,,,2,,,,,,使用タイミング：通常 ■君のデッキの上から３枚見て、その中の１枚をドライブする。それ以外のカードをデッキの下に置く。,,"日本は学んだ。精神論に頼る愚かしさを。
同時に忘れまい。志なき者が兵（つわもの）とならぬ事もまた、事実であると。",4
2020GB01-068,★★★,サクラノセイ,,,ユニット,東妖軍,怪異,,,,1,5,1,1,OD,,【OD】相手のフィールドカード１枚を選び、破壊する。 ■「障り」 これに戦闘ダメージが与えられた時、敵ユニット１体を選び、同じダメージを与える。,,春の度に咲く。春の度に散る。,4
2020GB01-069,★★★,冬将軍 御影,,,ユニット,東妖軍,怪異,戦士,,,1,2,1,1,CNT OD,,【OD】「凍結破砕」 守備ゾーンの敵ユニット１体を選び、破壊する。,これの【OD】能力を使う。,"東妖軍と妖怪は雇用契約ではなく、昔ながらの義理と人情で繋がっている。それゆえに、北の怪異の元締めにして雪女である、彼女のような者が必要なのだ。
設定 一（はじめ） 命名 ネメシス",4
2020GB01-070,★★★,合体拡張兵装 益荒男 『金剛体』,,,ユニット,東妖軍,ミリタリー,ロボ,,,3,5,4,1,CNT,,【ソウルガード】【２回攻撃】 ■これは守備ゾーンに置けない。,君の墓地から“益荒男”を好きな枚数選び、デッキに戻してもよい。そうしたらシャッフルする。,魔力と科学の完全な同調。それが益荒男の力となる。,4
2020GB01-071,★★★,たたりじゃーー！！,,,イベント,東妖軍,アクシデンツ,,,,-5,,,,CNT,,使用タイミング：【オープンカード】（これが手札に入った時、またはドライブした時、必ず公開してプレイする。） ■君は２ダメージ受ける。,これをプレイする。,なんでデッキに入れちまったんだ!,4
2020GB01-072,★★,牛鬼 羅喉,,,ユニット,東妖軍,怪異,ビースト,,,2,4,5,3,,,,,"ふと夜空を見上げると、そこには異形が。
ああそうか、夜は彼らに還したのだった。",4
2020GB01-073,★★,牛鬼 天狼,,,ユニット,東妖軍,怪異,ビースト,,,2,3,3,1,OD,,【OD】「百鬼夜行Lv１」 君のデッキの上から１枚見て、それがレベル１以下の怪異のユニットならドライブしてよい。ドライブしないならデッキの下に置く。 ,,"妖怪たちは言った。「夜を還せ。お前たちが失わせた、心休まる闇を還すのだ。」
都知事は答えた。「では、深夜からの計画停電で対応しましょう。」",4
2020GB01-074,★★,陸戦拡張兵装 益荒男 弐號機,,,ユニット,東妖軍,ミリタリー,ロボ,,,2,3,3,1,CNT,,■「益荒合身」 通常：これと、君の“益荒男　壱號機”があれば、君のデッキから“益荒男 『金剛体』”を１体特殊召喚し、これと“益荒男 壱號機”を１枚ずつソウルに入れる。,デッキから“益荒男 壱號機”を１体、攻撃ゾーンに特殊召喚する。,魔力エンジンと超電導プラズマエンジンのマッチングに成功。次は妖力炉を含めた三機合体だ！,4
2020GB01-075,★★,特殊国民法（妖怪法）,,,イベント,東妖軍,歴史,,,,2,,,,CNT,,使用タイミング：通常（君のターンのメインフェイズに、手札からか、セットしてプレイする。あるいは、ドライブした時にプレイする。） ■ライフを１回復する。,これをプレイする。,妖怪のいる風景。時折襲い来る侵略次元。そんな非日常すらも、いつしか新たな日常として受け入れていく。それこそが人々の強さなのかも知れない。,4
2020GB01-076,★★,ミスター死語,,,ユニット,東妖軍,戦士,ヒーロー,,,1,3,3,1,,,■「殴りたい笑顔」 これが攻撃ゾーンにある時、君への戦闘ダメージは０になる。,,ナウ（死語）なヤング（死語）にバカウケ（死語）！ ミスター死語だよ～ん。ナ～ンチャッテ（死語）!!,4
2020GB01-077,★★,生者必滅,,,イベント,東妖軍,戦技,,,,1,,,,CNT,,使用タイミング：即時（セットして、いつでも使える。） ■味方ユニット１体を選び、ターン終了時までATK＋２、HP＋２し【反撃】を与える。,これを墓地に置く。,無常なり。どのみち果てる身で。,4
2020GB01-078,★,竜型決戦兵器“火雷”,,,ユニット,東妖軍,ドラゴン,ミリタリー,,,3,5,4,2,,,■「自動攻撃システム業炎」 これが攻撃した時、敵ユニット１体以上を選び、３ダメージを割り振る。,,ウォルナー製魔力エンジンの実用試験はこの機体で完成した。いよいよ次は……大和だ。,4
2020GB01-079,★,女天狗 瑞風,,,ユニット,東妖軍,怪異,風,,,1,3,1,2,,,■「隼風」 君の怪異は【警戒】を得る。,,「オブザーバーとして意見は求められましたが、本来は民俗学者の出る幕ではなかったでしょう。まさか『妖怪とは情報生命体ではないか』との仮説が認められるとは。」 民俗学者・作家 遠野幸慈（ゆきじ）,4
2020GB01-080,★,100軾戦車,,,ユニット,東妖軍,ミリタリー,,,,1,4,4,2,,,,,運用実積のある100軾は、ウォルナーの魔法技術を導入するテストベッドとして選ばれた。今後様々な実験機が作られるだろう。,4
2020GB01-081,★,第一次次元防衛戦,,,イベント,東妖軍,歴史,,,,1,,,,,,使用タイミング：セットして、味方ユニットが攻撃されている時に使える。 ■味方ユニット１体を選び、この戦闘終了時までATK＋2し【迎撃】を与える。（【迎撃】を持つユニットが攻撃された時、戦闘ダメージ計算前に迎撃を持つユニットのATK分のダメージを攻撃してきたユニットに与える。）,,デスティニー・ソードの落着と共に侵略次元が出現した。同時に現れた異世界の援軍と共に、人類は侵略次元の第一陣を撃退。それから数年……,4
2020GB01-082,★,四方祓い,,,イベント,東妖軍,魔法,,,,1,,,,CNT,,使用タイミング：通常（君のターンのメインフェイズに、手札からか、セットしてプレイする。あるいは、ドライブした時にプレイする。） ■フィールドカードかセットカード１枚を選び、破壊する。,これをプレイする。,鬼垣家。鬼界を隔離し、裏京都を呪術的に代々守護してきた家系。鬼ノ宮家とは表裏１体の関係である。,4
2020GB01-083,★,方違え,,,イベント,東妖軍,魔法,,,,1,,,,,,使用タイミング：セットして、君か味方ユニットにダメージが与えられる時に使える。 ■次のダメージを０にする。,,世界の境界線が壊されたあの日。古の呪いは無力なオカルトではなく、銃弾をも弾く物理的な力を得た。,4
2020GB01-084,★,百目の召霊,,,ユニット,東妖軍,怪異,,,,0,2,1,1,OD,,【OD】「百鬼夜行Lv０」 君のデッキの上から１枚見て、それがレベル０の怪異のユニットならドライブしてよい。ドライブしないならデッキの下に置く。 ,,「俺たちも日本国民だ！軍に入って闘うぜ」と訴える妖怪たちに報いるべく、未門内閣は「特殊国民法」を設立させた。,4
2020GB01-085,★,ゆきんこ 牡丹,,,ユニット,東妖軍,怪異,,,,0,2,3,2,,,,,各地方自治体の妖怪課は、いわゆる「妖怪不祥事案件」の対応に大忙し。気の毒に思った妖怪たちは自重した。具体的にはコンビニの冷凍庫に入って動画を撮ったりしなくなった。,4
2020GB01-086,★,黒河童の玄九郎,,,ユニット,東妖軍,怪異,闇,,,0,3,3,1,OD,,【OD】相手と決着が付くまでジャンケンする。負けた方は１ダメージを受ける。君が負けたなら、これを破壊してもよい。そうしたらこの効果をやり直す。,,魚食おうか、人とって食おか。,4
2020GB01-087,★,三毛猫・ケットシー,,,ユニット,東妖軍,怪異,ビースト,魔術師,,0,2,1,1,,,【ファミリア】（通常：これに、ターン終了時まで任意の属性を１つ追加する。） ■通常：これのレベルを、ターン終了時まで１か２にする。,,ケットシーは世界中にいる。貴方の飼い猫も実はそうなのかも知れない。,4
2020GB01-088,★,陽炎童子,,,ユニット,東妖軍,鬼The島,怪異,,,0,4,2,1,,,,,地獄の釜が開けばよ、俺たち「鬼The島」の本番だぜ。,4
2020GB01-089,★,機械化歩兵大隊“白夜”,,,ユニット,東妖軍,ミリタリー,,,,0,2,1,1,,,【警戒】（君のアタックフェイズ終了時に、これを攻撃ゾーンから守備ゾーンに移動させてもよい。）,,"アジアを中心とした、侵略次元に対する軍事同盟。
東洋「妖怪」「魔物」「人類」連合軍、略して「東妖魔人連合軍」である。",4
2020GB01-090,★,補給部隊“破間”,,,ユニット,東妖軍,戦士,ミリタリー,ロボ,,0,2,2,1,OD,,【OD】君のデッキの上から１枚見て、それがセットできるカードであればセットしてもよい。セットしないならデッキの下に置く。,,輸送部隊の隊員の多くは、民間の運送業者でもある。彼らは、常時は人々の生活を守るため、戦時は人々の命を守るために、走る。,4
2020GB01-091,★,剛力招来,,,イベント,東妖軍,戦技,魔法,,,0,,,,,,使用タイミング：即時（セットして、いつでも使える。） ■味方ユニット１体を選び、ターン終了時までATK＋２ 、HP＋２する。,,強き力よ、我に宿りたまえ。人を超えし力よ、我が身を依代として顕現せよ。,4
2020GB01-092,★,大祓,,,イベント,東妖軍,魔法,,,,0,,,,CNT,,使用タイミング：即時（セットして、いつでも使える。） ■全ての味方ユニットを、ターン終了時までHP＋２する。,味方ユニット１体を選び、守備ゾーンに置いてもよい。,「思うに、魔術も陰陽も、信じる事で発現するのでしょう。術として正しいからではない。きっと世界の物理法則が……人の想いに応えるよう変化したのです。コウガさんのゲートルーラー能力然り、ね。」,4
2020GB01-093,★★★★Ⓛ,侵略大帝,,,ユニット,マジカルユニバース,エブリデイクライム,ヒーロー,,,3,2,1,1,CNT OD,LEGEND,【OD】「カリスマ波」 レベル２以下の敵ユニット１体を選び、コントロールを得る。,これの【OD】能力を使う。,宇宙の大帝を自称する謎の怪人を、エブリデイクライムは食客として受け入れた。頭部デザインにシンパシーを感じて。,4
2020GB01-094,★★★★,スペース円卓の騎士 宇宙アーサー,,,ユニット,マジカルユニバース,宇宙遺産,ヒーロー,ロボ,,3,6,4,0,CNT,,■これは通常召喚することも、セットすることもできる。 ■「ファイナルガーディアン【ゲーム１】」 君のライフが０になった時、これをセットゾーンから通常召喚出来る。そうしたらライフを１回復して、ターンを終了させる。 【２回攻撃】,君のライフが２以下なら、これをセット出来る。,宇宙の民がピンチに陥った時、どこからともなく現れて人々を救う。彼は人なのか神なのか、はたまたUMA的なサムシングなのか。,4
2020GB01-095,★★★★,イドのタイガー,,,ユニット,マジカルユニバース,ビースト,,,,3,7,5,2,CNT,,■「虎よ、虎よ！」 場に君の他のビーストがあれば、これが相手に与えたダメージでは【CNT】出来ない。,これを墓地に置く。,お前の恐怖に、宇宙が応える。虎を呼ぶのはお前なのだ。,4
2020GB01-096,★★★★,大首領 宇宙魔神ダイアクトー,,,ユニット,マジカルユニバース,エブリデイクライム,,,,3,3,5,2,OD,,【OD】君のデッキの上から２枚をこれのソウルに入れる。 ■場の君の他のエブリデイクライムが墓地に置かれる時、代わりにこれのソウルに入れる。 ■「デバスビーム」 即時［これのソウルを１枚デッキの下に置く］敵ユニット１体を選び、２ダメージを与える。 ■これは【ソウルガード】を得る事が出来ない。,,未来に悩む若者よ。まずは形から入りたまえ。,4
2020GB01-097,★★★★,ZAPZAPZAP！,,,イベント,マジカルユニバース,火力,魔法,,,3,,,,CNT,,使用タイミング：即時（セットして、いつでも使える。） ■敵ユニット１体以上を選び、６ダメージを割り振る。,これをプレイする。,宇宙冒険家、押し掛け記者、迷子の地球人、そして犯罪組織の勧誘員。滅茶苦茶なメンバーの中にも、いつしか仲間意識が芽生えていた。,4
2020GB01-098,★★★,シュレディンガーの猫,,,イベント,マジカルユニバース,アクシデンツ,,,,3,,,,CNT,,使用タイミング：通常 ■君のダメージゾーンのカード１枚を選び、コストや召喚権を支払わず、それをプレイする。（手札やドライブゾーンからのプレイではないので、ユニットの【OD】や【TD】は発動しない。）,君の、墓地のカード１枚とダメージゾーンのカード１枚を選び、それらを入れ替える。,観察者が存在しない時、あらゆるものの真の実在は、証明出来ない。,4
2020GB01-099,★★★,ホラー軍団団長 ガチホラー,,,ユニット,マジカルユニバース,エブリデイクライム,,,,2,4,5,1,OD TD,,【OD】【TD】以下のどちらかを行う。 ◯相手の手札を１枚ランダムに捨てさせる。 ◯相手のセットカード１枚を選び、破壊する。,,彼はテレパシーで他者の思考が読めるので、情に厚く公平な人事部長として誰からも信頼されている。,4
2020GB01-100,★★★,宇宙ジャーナリスト クリステル,,,ユニット,マジカルユニバース,フューチャーメン,,,,1,2,2,1,OD TD,,【TD】【OD】君のデッキの上から２枚見て、セット出来るカードがあれば、１枚セットしてもよい。残りをデッキの下に置く。,,謎のヒーロー宇宙アーサーの目撃例が、ヴェルオクト号に集中していると気づいた彼女は、なかば押し掛ける形で船に乗り込んで来た。,4
2020GB01-101,★★★,太陽系バックパッカー,,,ユニット,マジカルユニバース,フューチャーメン,,,,1,4,4,1,,,■通常：［場の君のカードを１枚墓地に置く］これをダメージゾーンから通常召喚する。君は１ダメージ受ける。,,マジカルユニバースの「距離」はイメージで決定するの。火星に２日で着くなら水星で３日、１週間で太陽系が１周出来るわ。,4
2020GB01-102,★★,突発性ブラックホール,,,イベント,マジカルユニバース,アクシデンツ,,,,3,,,,,,使用タイミング：【オープンカード】（これが手札に入った時、またはドライブした時、必ず公開してプレイする。コストは、可能な限り支払う。） ■敵ユニットを全て破壊する！,,"「人生で何度もブラックホールに吸われる奴って、いるかなぁ。」
「もう慣れましたね。」",4
2020GB01-103,★★,宇宙船ヴェルオクト号,,,ユニット,マジカルユニバース,宇宙遺産,フューチャーメン,,,2,4,5,3,,,,,“聖杯”を探し当てたと言う宇宙冒険家エドが設計し、建造した宇宙最速の戦闘艇。動力は不明。その機体に、聖杯の秘密を隠していると言う。,4
2020GB01-104,★★,ホラー軍団 エックス街の物体エルム,,,ユニット,マジカルユニバース,エブリデイクライム,,,,2,3,5,2,,,【反撃】（これが敵ユニットに攻撃されて破壊されなかった時、攻撃ユニットにATK分のダメージを与える。）,,エブリデイクライムは法を破り、全てを暴力で解決する。麻薬組織に牛耳られた惑星に、依存性の低い麻薬を広め麻薬組織を壊滅させたり、独裁者の惑星を侵略して民衆を解放、市場を開拓したり……まさにやりたい放題である。,4
2020GB01-105,★★,宇宙犯罪組織エブリデイクライム,,,イベント,マジカルユニバース,エブリデイクライム,,,,2,,,,CNT,,使用タイミング：通常 ■君のデッキの上から４枚見て、その中からエブリデイクライムのカード１枚を選び、ドライブする。ドライブしなかったカードをデッキに下に置く。,「再生怪人」 君の墓地からレベル１以下のエブリデイクライムのユニット１体を選び、特殊召喚する。,若者よ。野望を持て。とりあえず地球儀を掴んでみろ。,4
2020GB01-106,★★,宇宙スフィンクス,,,ユニット,マジカルユニバース,怪異,ビースト,ピポバース,,1,3,4,1,,,【反撃】（これが敵ユニットに攻撃されて破壊されなかった時、攻撃ユニットにATK分のダメージを与える。）,,強靭な前足で相手を捕らえ、身動きを取れなくさせたら、お待ちかねのクイズショウ。100問正解まで脱出不能。,4
2020GB01-107,★★,マジック・ブラスター,,,イベント,マジカルユニバース,火力,魔法,,,1,,,,CNT,,使用タイミング：即時（セットして、いつでも使える。） ■敵ユニット１体を選び、３ダメージを与える。,これをプレイする。,エド「地球人のポジティブ・エナジーは桁外れだ。君ならこの伝説の銃を使いこなせるだろう。」,4
2020GB01-108,★,フォトン・トーピード,,,イベント,マジカルユニバース,ミリタリー,,,,2,,,,CNT,,使用タイミング：即時（セットして、いつでも使える。） ■以下のどちらかを行う。 ◯相手に１ダメージを与える。 ◯相手のセットカード１枚を選び、破壊する。,これをプレイする。,法は確かに、惑星の上では機能している。だが広大すぎる宇宙では、自分の身は自分で守るしかないんだ。,4
2020GB01-109,★,ダブルエックスカリバー！,,,イベント,マジカルユニバース,ピポバース,,,,2,,,,CNT,,使用タイミング：即時（セットして、いつでも使える。） ■敵ユニット１体を選び、４ダメージを与える。場に君の“宇宙アーサー”があれば、代わりにその敵ユニットを破壊する。,これをプレイする。,"クリステル「エックスカリバー！宇宙でたった１つの神秘の鉱石、カリバーナイトで出来た伝説の剣よ！」
アドリアーノ「いや、２本あるじゃん?!」",4
2020GB01-110,★,ホラー軍団 サメリアン,,,ユニット,マジカルユニバース,エブリデイクライム,サメ,ビースト,,1,3,2,2,,,■相手の手札が１枚以下なら、これはATK＋２、 HP＋２される。,,ホラー軍団は味方にも恐れられる恐怖の軍団だ。だがその構成員は皆優れた人格者である。こんななりして。,4
2020GB01-111,★,マジック・イノベイター,,,ユニット,マジカルユニバース,フューチャーメン,魔術師,,,1,3,2,2,OD,,【OD】君の墓地から【CNT】を持つカード２枚までを選び、デッキに戻す。そうしたらシャッフルする。（【OD】とは、ドライブしたユニットが場に出る前にドライブゾーンで使える能力）,,マジカルユニバースの魔法は「概念魔法」。思い込めば真実になる。,4
2020GB01-112,★,万能ロボ ポジム,,,ユニット,マジカルユニバース,フューチャーメン,ロボ,,,1,2,5,2,,,,,"リクルーター「なんと！P-ZM型じゃないですか！ 言語中枢に欠陥のあったロボニカ社唯一の失敗作！　回収されずに実働しているなんて信じられない！」
ポジム「この緑色野郎、エアロックから叩き出すでございますよ」",4
2020GB01-113,★,ホラー軍団 ハンニバル・レイザー,,,ユニット,マジカルユニバース,エブリデイクライム,怪異,,,1,3,3,1,OD TD,,【OD】【TD】相手は手札を１枚捨てる。,,彼は自分のように、他人にも笑顔を浮かばせたいと願っている。彼の笑顔が恐いのは彼のせいではない。,4
