2020GB01-114,★,マスターフューチャー エド,,,ユニット,マジカルユニバース,フューチャーメン,,,,0,1,1,1,CNT OD,,【OD】「原子破壊銃」 敵ユニット１体を選び、２ダメージを与える。,これの【OD】能力を使う。,宇宙工学の権威であり、銀河に散らばる宇宙遺産の謎を追う冒険考古学者。同じく宇宙遺産を求める犯罪組織、エブリデイクライムとは宿敵同志である。,4
2020GB01-115,★,宇宙リザードマン,,,ユニット,マジカルユニバース,戦士,ビースト,ピポバース,,0,3,2,1,OD,,【OD】これを、ターン終了時までATK＋２する。（【OD】とは、ドライブしたユニットが場に出る前にドライブゾーンで使える能力）,,"「お前、エブリデイクライムの構成員か?!」
笑顔を浮かべ話しかけてきた宇宙リザードマンにリクルーターは駆け寄った。彼はリザードマンの笑顔が怒りを表す事を知らなかったのだ。",4
2020GB01-116,★,海王星雪女,,,ユニット,マジカルユニバース,怪異,ピポバース,,,0,4,3,1,,,,,"アドリアーノ「手が冷たい女性は心が温かいのさ。」
雪女「まあ。地球の方はお上手ね。」
リクルーター「こりゃいけません。アドリアーノさんが凍りついてる。」
ポジム「動力炉に突っ込めば治りやがるでしょ。」",4
2020GB01-117,★,ギャラクシー 一反木綿,,,ユニット,マジカルユニバース,怪異,布,ピポバース,,0,2,4,1,,,,,"アドリアーノ「ジャパンの妖怪の一反木綿みたいだな。」
エド「それはいい。彼には名前がなかったんだ。そう呼ぼう。」
クリステル「本人も気に入ったみたいね。」",4
2020GB01-118,★,エブリデイクライム戦闘員 バッドマンズ,,,ユニット,マジカルユニバース,エブリデイクライム,ピポバース,,,0,3,2,1,,,■「愛社精神」 場の君の他のエブリデイクライムのユニットにダメージが与えられる時、これを破壊してもよい。そうしたらそのダメージを０にする。,,週休二日。労働時間は一日六時間。保養サービス充実。どこよりも正確な人事評価有り。ブラックな組織だが構成員にとってはホワイトだ。,4
2020GB01-119,★,エーテルフィールド,,,イベント,マジカルユニバース,魔法,,,,0,,,,,,使用タイミング：セットして、君が攻撃されている時に使える。 ■その戦闘ダメージを０にする。,,何とかしてエブリデイクライムに帰りたいリクルーターだったが、エブリデイクライムとエドは宿敵同士。出会う度に100％戦闘になって逃げ出すチャンスもありゃしない。,4
2020GB01-120,★,絶対爆発！ 宇宙ミミック,,,イベント,マジカルユニバース,怪異,,,,0,,,,,,使用タイミング：即時（セットして、いつでも使える。） ■敵ユニット１体を選び、１ダメージを与える。 ■セットされているこれが相手の効果によって破壊された時、相手に２ダメージを与える。,,宇宙ミミックは、並の宇宙船では逃げ切れない速度で獲物を追う。つまり偽装して獲物を待ち構えるライフスタイルとあっていない。,4
2020GB01-121,★,突然のワームホール,,,イベント,マジカルユニバース,アクシデンツ,,,,0,,,,CNT,,使用タイミング：セットして、敵ユニットが攻撃した時、君の攻撃ゾーンにユニットがあれば使える。 ■味方ユニット１体を選び、その敵ユニットの攻撃先をその味方ユニットのラインに変更する。 ,敵ユニット１体を選び、レストする。,"「このカードの枠のデザインが、折りたたまれた余剰空間を開放するんだ。」アドリアーノは言った。
「そう感じられるようになったんだよ。カードが“門”になるってね。」",4
2020GB01-122,★,キャプチャービーム,,,イベント,マジカルユニバース,ミリタリー,,,,0,,,,,,使用タイミング：通常（君のターンのメインフェイズに、手札からか、セットしてプレイする。あるいは、ドライブした時にプレイする。） ■君の墓地からレベル０のユニット１体を選び、手札に戻すか、特殊召喚する。（特殊召喚では【TD】や【OD】は使えない。）,,宇宙の迷子になった二人は、冒険家エドに救助された。リクルーターはエブリデイクライムの構成員である事を秘密にするしかなかった。,4
2020GB01-123,★★★★,白骨姫,,,ユニット,侵略次元,神,,,,2,4,4,2,CNT,,,相手は自分のユニット１体を選び、破壊する。,その表情は、その心を表さず、その姿も、その有様と欠片すら重ならない。,4
2020GB01-124,★★★,デスティニー・ソード,,,イベント,侵略次元,歴史,,,,3,,,,CNT,,使用タイミング：即時（セットして、いつでも使える。） ■敵ユニット１体を選び、破壊する。,これをプレイする。,異界の挑戦状を叩きつけられたあの日から……世界はもう、決して元には戻らない。,4
2020GB01-125,★,ヴァムハ,,,ユニット,侵略次元,オブジェ,,,,2,4,4,2,,,■「魂果てる場所」 これが場に出た時、敵ユニット１体を選び、これのソウルに入れる。これが場から離れる時、相手はそのユニットのコントロールを得る。,,お前は何だ。私を何処へ連れて行くんだ?!,4
2020GB01-126,★,デバウラー,,,ユニット,侵略次元,DWM,,,,1,2,2,1,,,■「集合生命体」 君の墓地に侵略次元が３枚以上なら、これはATK＋２、STK＋２される。,,ウォルナーでも、アークでも、侵略次元の者たちと意志を交わせた者はいない。心を読んだものは皆、発狂した。,4
2020GB01-127,★,先触れの蝶,,,ユニット,侵略次元,オブジェ,,,,0,3,4,1,,,,,"侵略次元の尖兵に唯一共通するもの。
それは絶対的な拒絶。数千年間、様々な世界が試みて、ただの一度もコミュニケート出来なかったという、絶望的な事実。",4
2020GB01-S,SEC,マグヴァリウスの業火,,,イベント,ウォルナー,ドラゴン,炎,,,3,,,,CNT,LEGEND,使用タイミング：通常■レベル２以下の攻撃ゾーンの敵ユニットを全て破壊する。,攻撃ゾーンの敵ユニット１体を選び、破壊する。,成したい事のみならず、成すべき事が世界の理となる。それがお前が掴むべき、王の力。,4
